{
  "schema_version": "context.verification-profile/v1alpha1",
  "profile_id": "verification/portable-python-library/default",
  "project_id": "portable-python-library",
  "profile_version": "1.0.0-alpha.1",
  "revision": 1,
  "valid_from": "2026-08-16T00:00:00+08:00",
  "valid_until": null,
  "gates": [
    {
      "gate_id": "build",
      "gate_kind": "build",
      "mode": "required",
      "condition_ref": null,
      "capability_refs": [
        "capability/python"
      ],
      "depends_on_gate_ids": [
        "tdd"
      ],
      "evidence_requirements": [
        "artifact-digest",
        "exit-status",
        "invocation"
      ],
      "thresholds": []
    },
    {
      "gate_id": "contract",
      "gate_kind": "contract",
      "mode": "conditional",
      "condition_ref": "condition/public-api-changed",
      "capability_refs": [
        "capability/python"
      ],
      "depends_on_gate_ids": [
        "build"
      ],
      "evidence_requirements": [
        "artifact-digest",
        "exit-status",
        "invocation"
      ],
      "thresholds": []
    },
    {
      "gate_id": "golden",
      "gate_kind": "golden",
      "mode": "conditional",
      "condition_ref": "condition/serialized-output-changed",
      "capability_refs": [
        "capability/python"
      ],
      "depends_on_gate_ids": [
        "build"
      ],
      "evidence_requirements": [
        "artifact-digest",
        "exit-status",
        "invocation"
      ],
      "thresholds": []
    },
    {
      "gate_id": "live",
      "gate_kind": "live",
      "mode": "optional",
      "condition_ref": null,
      "capability_refs": [
        "capability/live-environment"
      ],
      "depends_on_gate_ids": [],
      "evidence_requirements": [
        "artifact-digest",
        "exit-status",
        "invocation"
      ],
      "thresholds": []
    },
    {
      "gate_id": "mutation",
      "gate_kind": "mutation",
      "mode": "conditional",
      "condition_ref": "condition/logic-changed",
      "capability_refs": [
        "capability/mutation-runner"
      ],
      "depends_on_gate_ids": [
        "tdd"
      ],
      "evidence_requirements": [
        "artifact-digest",
        "exit-status",
        "invocation"
      ],
      "thresholds": [
        {
          "metric": "mutation_score",
          "operator": "gte",
          "value": 8000,
          "unit": "basis-points"
        }
      ]
    },
    {
      "gate_id": "performance",
      "gate_kind": "performance",
      "mode": "conditional",
      "condition_ref": "condition/hot-path-changed",
      "capability_refs": [
        "capability/local-benchmark"
      ],
      "depends_on_gate_ids": [
        "build"
      ],
      "evidence_requirements": [
        "artifact-digest",
        "exit-status",
        "invocation"
      ],
      "thresholds": []
    },
    {
      "gate_id": "static",
      "gate_kind": "static",
      "mode": "required",
      "condition_ref": null,
      "capability_refs": [
        "capability/python"
      ],
      "depends_on_gate_ids": [],
      "evidence_requirements": [
        "artifact-digest",
        "exit-status",
        "invocation"
      ],
      "thresholds": []
    },
    {
      "gate_id": "tdd",
      "gate_kind": "tdd",
      "mode": "required",
      "condition_ref": null,
      "capability_refs": [
        "capability/python"
      ],
      "depends_on_gate_ids": [
        "static"
      ],
      "evidence_requirements": [
        "artifact-digest",
        "exit-status",
        "invocation"
      ],
      "thresholds": []
    }
  ],
  "state_write_authority": false,
  "completion_authority": false,
  "profile_sha256": "bf28a83333742572a9e88b23897bd109fee55e0ceb231833e1c0a93547e72d19"
}
